{
  "catalog_version": "1.0",
  "catalog_revision": "growth-agent-catalog-v1",
  "roles": [
    {"role_id": "growth-coordinator", "path": "roles/core/growth-coordinator.json", "sha256": "84dcf07a394b086f4c928b3e70771374b37af5e83be4bad33fb292c80850af8e"},
    {"role_id": "governance-reviewer", "path": "roles/core/governance-reviewer.json", "sha256": "fdb55a54f3080412ca625a6b746497b49e16d6df3fa6a6fdb236856c416df8af"},
    {"role_id": "evidence-research", "path": "roles/core/evidence-research.json", "sha256": "b17dc14f6b37b3aabc5d70e68dc576ed18fcf979e05c7ae54a9382f44aec77b5"},
    {"role_id": "audience-voc", "path": "roles/core/audience-voc.json", "sha256": "66de1b9565faf6084b91240e97005b6cdbfcd20c45984c8bdddd8ca87bc84cb0"},
    {"role_id": "product-marketing-positioning", "path": "roles/core/product-marketing-positioning.json", "sha256": "234656da4a9ac0b2d00e0496e743ee4f8cdef7038df36c37a546381cf76c3fa0"},
    {"role_id": "growth-product-cro", "path": "roles/core/growth-product-cro.json", "sha256": "a269a58f2fa0054fa8a2a1860aa70073511a2f3828df25f8b6a99d160da07a4c"},
    {"role_id": "analytics-experimentation", "path": "roles/core/analytics-experimentation.json", "sha256": "5378ff56b90b9519e190b6bb23e3faf6081614e71cad8ab82e66c02b8825cc46"},
    {"role_id": "content-strategy", "path": "roles/core/content-strategy.json", "sha256": "6daae8276ac8cbaf8305210db5a5b8a8239817129959d5ee82a86d53141fe586"},
    {"role_id": "editorial-production", "path": "roles/core/editorial-production.json", "sha256": "54c884d86dfb51fbf65d3a335e7bb76e12120dc13d97ed4eaf5dc9c85471db78"},
    {"role_id": "search-ai-discovery", "path": "roles/specialists/search-ai-discovery.json", "sha256": "244c83f192ca5201a970eb833c1f22874d7d8e3932d0e34006a3e64cf117a0fe"},
    {"role_id": "lifecycle-crm", "path": "roles/specialists/lifecycle-crm.json", "sha256": "c5edabc8fd78dabbac3385a7c2d8300fcae8603d24d14250f0c49c448c121131"},
    {"role_id": "social-media", "path": "roles/specialists/social-media.json", "sha256": "a8b041f5640bf7adc52127bcac0921d5fbf2acc299cb9ea2ea6b4053f9280e2b"},
    {"role_id": "community", "path": "roles/specialists/community.json", "sha256": "e6052c233fc4c9e2838fbe08a50c322a04a33e66cf8ce054cc3afe29fbed95f5"},
    {"role_id": "demand-generation", "path": "roles/specialists/demand-generation.json", "sha256": "5323aa4be8652fe4981a8ea65ea52dc1a16ce0d4e463965f08ba333b235a9387"},
    {"role_id": "paid-acquisition", "path": "roles/specialists/paid-acquisition.json", "sha256": "9871521e29b773b46eb0ff314cceabf829b91841826a67e1cee8419d6a93b6f4"},
    {"role_id": "partnerships", "path": "roles/specialists/partnerships.json", "sha256": "f6e929515264ac9c0dbf46641b66aa1b2781c541dba19517b0108e7aebf5d1f4"},
    {"role_id": "brand-creative", "path": "roles/specialists/brand-creative.json", "sha256": "a7edbd55f156f125a042518cbea08a166ee2cfaebb971cd125bcb5cb3316c9c5"},
    {"role_id": "developer-relations", "path": "roles/specialists/developer-relations.json", "sha256": "19d8fd84a5c46467ae786173e18e35332ea364856bd170627598f168d6022b92"},
    {"role_id": "marketing-ops-revops", "path": "roles/specialists/marketing-ops-revops.json", "sha256": "6b7c456c115420932d74f6fc024ee59689507b008d45019a10e417ed135553b8"}
  ],
  "routes": [
    {
      "route_id": "research-evidence",
      "path": "routes/research-evidence.json",
      "sha256": "c20c8413b8365f7b27908ac5261da7aedb557b27f6e94303312cf3f5e3f6a303",
      "required_context": ["facts", "prohibited_claims", "market", "authority"],
      "steps": [
        {"step_id": "coordinate", "role_id": "growth-coordinator", "depends_on": [], "optional": false, "run_when": "always", "objective": "Frame one decision question, evidence standard, scope, budget, and stop rule.", "output_contract": "result-envelope@2", "deliverable_contract": "task-set@1", "allowed_write_roots": ["handoffs", "records/decisions"]},
        {"step_id": "research", "role_id": "evidence-research", "depends_on": ["coordinate"], "optional": false, "run_when": "always", "objective": "Collect bounded evidence and preserve sources, contradictions, unknowns, and confidence.", "output_contract": "result-envelope@2", "deliverable_contract": "evidence-packet@1", "allowed_write_roots": ["evidence/packets", "handoffs"]},
        {"step_id": "governance-final", "role_id": "governance-reviewer", "depends_on": ["research"], "optional": false, "run_when": "always", "objective": "Review the exact evidence packet for source scope, policy, authority, revision, and proof boundaries.", "output_contract": "result-envelope@2", "deliverable_contract": "governance-verdict@1", "allowed_write_roots": ["records/governance", "handoffs"]}
      ],
      "final_product_contract": "evidence-packet@1",
      "governance_step_id": "governance-final",
      "terminal_state": "review_ready",
      "human_actions": ["approve", "decline", "note"],
      "may_publish": false
    },
    {
      "route_id": "organic-audience-community",
      "path": "routes/organic-audience-community.json",
      "sha256": "be6ca52570f48a13fa5bd92d6ec42c318c6f18fda1d3f61087f70e53a8c5701d",
      "required_context": ["facts", "prohibited_claims", "audience", "market", "channels", "authority"],
      "steps": [
        {"step_id": "coordinate", "role_id": "growth-coordinator", "depends_on": [], "optional": false, "run_when": "always", "objective": "Bind one organic audience objective, surface, evidence standard, relationship boundary, non-goals, and stop rule.", "output_contract": "result-envelope@2", "deliverable_contract": "task-set@1", "allowed_write_roots": ["handoffs", "records/decisions"]},
        {"step_id": "audience-evidence", "role_id": "evidence-research", "depends_on": ["coordinate"], "optional": false, "run_when": "always", "objective": "Collect bounded public and project evidence about the audience question, channel constraints, recurring needs, contradictions, and proof gaps.", "output_contract": "result-envelope@2", "deliverable_contract": "evidence-packet@1", "allowed_write_roots": ["evidence/packets", "handoffs"]},
        {"step_id": "community-insight", "role_id": "community", "depends_on": ["audience-evidence"], "optional": true, "run_when": "Activate only when a real recurring group, current aggregate signals, moderation boundaries, and a human community owner are evidenced.", "objective": "Turn aggregate community evidence into a bounded audience-change proposal and feedback-closure design without outreach, sanctions, or relationship automation.", "output_contract": "result-envelope@2", "deliverable_contract": "community-program@1", "allowed_write_roots": ["handoffs", "records/audience"]},
        {"step_id": "developer-journey", "role_id": "developer-relations", "depends_on": ["audience-evidence"], "optional": true, "run_when": "Activate only for a public API, SDK, integration, or developer product with a bounded external-developer journey and supported-version evidence.", "objective": "Prepare a technical discovery package covering time to first success, documentation friction, examples, limitations, and a human-owned feedback loop.", "output_contract": "result-envelope@2", "deliverable_contract": "developer-experience-package@1", "allowed_write_roots": ["handoffs", "records/discovery"]},
        {"step_id": "social-product", "role_id": "social-media", "depends_on": ["audience-evidence", "community-insight", "developer-journey"], "optional": true, "run_when": "Activate only when the selected organic objective includes one enabled social surface with current channel rules, metric definitions, and a human account owner.", "objective": "Produce one complete platform-native channel product bound to exact claims, sources, limitations, and any activated community or developer findings without posting it.", "output_contract": "result-envelope@2", "deliverable_contract": "social-package@1", "allowed_write_roots": ["handoffs", "staging"]},
        {"step_id": "organic-package", "role_id": "product-marketing-positioning", "depends_on": ["audience-evidence", "community-insight", "developer-journey", "social-product"], "optional": false, "run_when": "always", "objective": "Assemble the supported organic audience thesis, mutual-value boundaries, channel sequence, readiness findings, owners, measurement, risks, non-goals, and explicit no-launch status.", "output_contract": "result-envelope@2", "deliverable_contract": "launch-readiness-package@1", "allowed_write_roots": ["handoffs", "positioning/packages", "staging"]},
        {"step_id": "governance-final", "role_id": "governance-reviewer", "depends_on": ["organic-package"], "optional": false, "run_when": "always", "objective": "Review the exact organic audience-readiness package and any supporting channel product for complete value, claims, privacy, rights, relationship boundaries, revision binding, and no-launch compliance.", "output_contract": "result-envelope@2", "deliverable_contract": "governance-verdict@1", "allowed_write_roots": ["handoffs", "records/governance"]}
      ],
      "final_product_contract": "launch-readiness-package@1",
      "governance_step_id": "governance-final",
      "terminal_state": "review_ready",
      "human_actions": ["approve", "decline", "note"],
      "may_publish": false
    },
    {
      "route_id": "demand-acquisition",
      "path": "routes/demand-acquisition.json",
      "sha256": "18929a633f7252c80304d7c7c80d7d9b5d629456401ae23e2d1fde5d7f275fc7",
      "required_context": ["facts", "prohibited_claims", "audience", "market", "funnel", "metrics", "channels", "authority"],
      "steps": [